{
 "$schema": "http://json-schema.org/draft-07/schema#",
 "title": "Coffret WEDDING BOX",
 "type": "object",
 "required": [
  "id",
  "numero",
  "titre",
  "communeId",
  "lieuId",
  "categorieId",
  "saisonId",
  "moments",
  "calendrier",
  "statut"
 ],
 "properties": {
  "id": {
   "type": "string",
   "pattern": "^C-[0-9]{3}$"
  },
  "numero": {
   "type": "integer",
   "minimum": 1,
   "maximum": 365
  },
  "titre": {
   "type": "string"
  },
  "communeId": {
   "type": "string",
   "pattern": "^CM-[0-9]{2}$"
  },
  "lieuId": {
   "type": "string",
   "pattern": "^L-[0-9]{3}$"
  },
  "categorieId": {
   "type": "string",
   "pattern": "^CAT-[0-9]{2}$"
  },
  "saisonId": {
   "type": "string",
   "pattern": "^SA-[0-9]{2}$"
  },
  "moments": {
   "type": "array",
   "items": {
    "type": "string"
   },
   "minItems": 1
  },
  "calendrier": {
   "type": "object",
   "required": [
    "jour",
    "jourDuMois",
    "mois"
   ]
  },
  "tags": {
   "type": "array",
   "items": {
    "type": "string"
   }
  },
  "accroche": {
   "type": "string"
  },
  "texte": {
   "type": "string"
  },
  "editorial": {
   "type": "object"
  },
  "lumiere": {
   "type": "object"
  },
  "pratique": {
   "type": "object"
  },
  "reperesDemo": {
   "type": "object"
  },
  "lieuxAssocies": {
   "type": "array",
   "items": {
    "type": "string"
   }
  },
  "coffretsLies": {
   "type": "array",
   "items": {
    "type": "string"
   }
  },
  "art": {
   "type": "object"
  },
  "mediaIds": {
   "type": "array",
   "items": {
    "type": "string"
   }
  },
  "sources": {
   "type": "array",
   "items": {
    "type": "object",
    "properties": {
     "source": {
      "type": [
       "string",
       "null"
      ]
     },
     "sourceType": {
      "type": [
       "string",
       "null"
      ]
     },
     "sourceUrl": {
      "type": [
       "string",
       "null"
      ]
     },
     "retrievedAt": {
      "type": [
       "string",
       "null"
      ]
     },
     "updatedAt": {
      "type": [
       "string",
       "null"
      ]
     },
     "externalId": {
      "type": [
       "string",
       "null"
      ]
     },
     "portee": {
      "type": [
       "string",
       "null"
      ]
     },
     "status": {
      "enum": [
       "PROPOSÉ",
       "TROUVÉ",
       "SOURCE OFFICIELLE",
       "À VÉRIFIER",
       "VÉRIFIÉ",
       "CALCULÉ"
      ]
     }
    }
   }
  },
  "statut": {
   "enum": [
    "PROPOSÉ",
    "TROUVÉ",
    "SOURCE OFFICIELLE",
    "À VÉRIFIER",
    "VÉRIFIÉ",
    "CALCULÉ"
   ]
  }
 }
}
