{"id":"C-048","numero":48,"titre":"Canal & Papier","communeId":"CM-03","lieuId":"L-019","categorieId":"CAT-02","saisonId":"SA-01","moments":["MO-03","MO-02"],"calendrier":{"jour":48,"jourDuMois":17,"mois":1,"annee":2026,"statut":"VÉRIFIÉ"},"tags":["Acier","Péniche","Bord d’eau"],"accroche":"Un coffret ancré à Église Saint-Christophe, Tourcoing, dans l’univers « Canal ».","texte":"Dix heures de mariage en immersion à Tourcoing, depuis Église Saint-Christophe. Reflets d’eau, passerelles d’acier, brume du matin sur la Deûle. À l’intérieur, les matières, les paliers de budget et les lieux alternatifs que personne ne vous montrera.","editorial":{"paragraphes":[{"titre":"Le lieu","texte":"La nef est un axe. Tout ce qui est disposé dans cet axe devient lisible — c’est un avantage pour une cérémonie, une contrainte pour un cocktail."},{"titre":"Le moment","texte":"Une cérémonie se joue sur un axe et sur le silence. Plus le décor est fort (nef, verrière, mur plein), plus le reste doit être retiré. Ce qu’il faut prévoir : un axe, du silence, un fond qui ne concurrence pas. Le coffret retient aussi la mairie : un créneau court, une adresse claire, des photos de sortie."},{"titre":"La lumière","texte":"Le 17 février, le soleil se lève à 07 h 56 et se couche à 18 h 08 : 10 h 12 de jour, golden hour à partir de 17 h 08. Journée moyenne : la golden hour arrive tôt dans la soirée, c’est la fenêtre à réserver pour les photos."}],"statut":"PROPOSÉ"},"lumiere":{"date":"2026-02-17","lever":"07:56","coucher":"18:08","dureeJour":"10 h 12","goldenHourDebut":"17:08","heureBleueDebut":"18:42","heureBleueFin":"07:22","midiSolaire":"13:02","declinaison":-11.9,"courbe":[0,0,0,0,0,0,0,0,0,14,26,36,42,44,42,36,27,14,1,0,0,0,0,0],"phrase":"Le 17 février, le soleil se lève à 07 h 56 et se couche à 18 h 08 : 10 h 12 de jour, golden hour à partir de 17 h 08.","methode":"calcul solaire NOAA simplifié","reference":"point de référence Lille 50.633 N / 3.067 E","precision":"± 1 à 3 minutes","status":"CALCULÉ"},"pratique":{"statut":"À VÉRIFIER","aVerifierRef":"typologie + standard du territoire"},"reperesDemo":{"budgetMontant":22000,"prestataires":17,"invites":190,"pages":14,"statut":"PROPOSÉ"},"lieuxAssocies":["L-021","L-022"],"coffretsLies":["C-047","C-040","C-051","C-034"],"art":{"hue":199,"sat":48,"light":8,"motif":"p0","methode":"génération déterministe (aucune image)","statut":"VÉRIFIÉ"},"mediaIds":["M-C-048-01"],"sources":[],"statut":"PROPOSÉ"}