{"id":"C-128","numero":128,"titre":"Vieux-Lille & Zinc","communeId":"CM-04","lieuId":"L-024","categorieId":"CAT-06","saisonId":"SA-02","moments":["MO-06","MO-09"],"calendrier":{"jour":128,"jourDuMois":8,"mois":4,"annee":2026,"statut":"VÉRIFIÉ"},"tags":["Laiton","Velours","Bougies"],"accroche":"Un coffret ancré à LaM, parc de sculptures, Villeneuve-d’Ascq, dans l’univers « Or & Velours ».","texte":"On entre par LaM, parc de sculptures, à Villeneuve-d’Ascq. Velours profond, laiton poli, bougies et or patiné. Le coffret déroule douze pages d’inspiration, la carte des lumières heure par heure et l’annuaire des artisans qui tiennent la journée debout.","editorial":{"paragraphes":[{"titre":"Le lieu","texte":"Ce type de lieu a ses propres règles (technique, programmation, sécurité). Ce n’est pas un frein : c’est ce qui garantit une acoustique et une lumière maîtrisées."},{"titre":"Le moment","texte":"Les discours tiennent à trois choses : un endroit où se mettre, une lumière qui isole et une acoustique qui pardonne. Ce qu’il faut prévoir : un point focal, un micro, une lumière qui isole. Le coffret retient aussi la séance photo : de l’heure dorée, des matières, de la profondeur."},{"titre":"La lumière","texte":"Le 8 mai, le soleil se lève à 06 h 10 et se couche à 21 h 19 : 15 h 09 de jour, golden hour à partir de 20 h 19. Journée longue : le cocktail peut commencer avant le coucher du soleil et il restera de la lumière pour la séance photo."}],"statut":"PROPOSÉ"},"lumiere":{"date":"2026-05-08","lever":"06:10","coucher":"21:19","dureeJour":"15 h 09","goldenHourDebut":"20:19","heureBleueDebut":"21:57","heureBleueFin":"05:31","midiSolaire":"13:44","declinaison":17.2,"courbe":[0,0,0,0,0,0,0,10,25,41,56,70,82,89,91,86,76,63,48,33,17,3,0,0],"phrase":"Le 8 mai, le soleil se lève à 06 h 10 et se couche à 21 h 19 : 15 h 09 de jour, golden hour à partir de 20 h 19.","methode":"calcul solaire NOAA simplifié","reference":"point de référence Lille 50.633 N / 3.067 E","precision":"± 1 à 3 minutes","status":"CALCULÉ"},"pratique":{"statut":"À VÉRIFIER","aVerifierRef":"typologie + standard du territoire"},"reperesDemo":{"budgetMontant":15000,"prestataires":23,"invites":180,"pages":23,"statut":"PROPOSÉ"},"lieuxAssocies":["L-023","L-025"],"coffretsLies":["C-243","C-357","C-124","C-303"],"art":{"hue":57,"sat":68,"light":11,"motif":"p2","methode":"génération déterministe (aucune image)","statut":"VÉRIFIÉ"},"mediaIds":["M-C-128-01"],"sources":[],"statut":"PROPOSÉ"}