{"id":"C-135","numero":135,"titre":"Gare & Vermeil","communeId":"CM-02","lieuId":"L-011","categorieId":"CAT-01","saisonId":"SA-02","moments":["MO-09","MO-07"],"calendrier":{"jour":135,"jourDuMois":15,"mois":4,"annee":2026,"statut":"VÉRIFIÉ"},"tags":["Loft","Brique","Industriel"],"accroche":"Ce que La Condition Publique permet d’imaginer, à Roubaix.","texte":"La Condition Publique — Roubaix. Murs de brique rouge, fumée douce, lumière rasante de fin d’après-midi. Un objet éditorial pensé comme un plan-séquence : moodboard, repérages photo, timing de cérémonie et adresses 100 % métropole.","editorial":{"paragraphes":[{"titre":"Le lieu","texte":"La matière dominante ici, c’est le minéral chaud. Ce type de décor pardonne peu l’improvisation : il faut mesurer la lumière (brique, acier, verrières, béton brut) avant de choisir une heure de cérémonie."},{"titre":"Le moment","texte":"La séance photo est le seul moment qui se planifie à la minute : la fenêtre de lumière est courte et ne se rattrape pas. Ce qu’il faut prévoir : de l’heure dorée, des matières, de la profondeur. Le coffret retient aussi la soirée : de la puissance électrique, des murs épais, un voisinage conciliant."},{"titre":"La lumière","texte":"Le 15 mai, le soleil se lève à 05 h 59 et se couche à 21 h 29 : 15 h 30 de jour, golden hour à partir de 20 h 29. Journée longue : le cocktail peut commencer avant le coucher du soleil et il restera de la lumière pour la séance photo."}],"statut":"PROPOSÉ"},"lumiere":{"date":"2026-05-15","lever":"05:59","coucher":"21:29","dureeJour":"15 h 30","goldenHourDebut":"20:29","heureBleueDebut":"22:09","heureBleueFin":"05:19","midiSolaire":"13:44","declinaison":18.9,"courbe":[0,0,0,0,0,0,0,13,27,43,58,72,84,92,94,89,78,65,50,35,19,5,0,0],"phrase":"Le 15 mai, le soleil se lève à 05 h 59 et se couche à 21 h 29 : 15 h 30 de jour, golden hour à partir de 20 h 29.","methode":"calcul solaire NOAA simplifié","reference":"point de référence Lille 50.633 N / 3.067 E","precision":"± 1 à 3 minutes","status":"CALCULÉ"},"pratique":{"statut":"À VÉRIFIER","aVerifierRef":"typologie + standard du territoire"},"reperesDemo":{"budgetMontant":14000,"prestataires":10,"invites":120,"pages":12,"statut":"PROPOSÉ"},"lieuxAssocies":["L-012","L-013"],"coffretsLies":["C-248","C-142","C-300","C-304"],"art":{"hue":13,"sat":57,"light":12,"motif":"p3","methode":"génération déterministe (aucune image)","statut":"VÉRIFIÉ"},"mediaIds":["M-C-135-01"],"sources":[],"statut":"PROPOSÉ"}