{"id":"C-054","numero":54,"titre":"Acier & Lumière","communeId":"CM-01","lieuId":"L-007","categorieId":"CAT-02","saisonId":"SA-01","moments":["MO-03","MO-01"],"calendrier":{"jour":54,"jourDuMois":23,"mois":1,"annee":2026,"statut":"VÉRIFIÉ"},"tags":["Bord d’eau","Brume","Reflets"],"accroche":"Un coffret ancré à Gare Lille-Flandres, Lille, dans l’univers « Canal ».","texte":"Dix heures de mariage en immersion à Lille, depuis Gare Lille-Flandres. Reflets d’eau, passerelles d’acier, brume du matin sur la Deûle. À l’intérieur, les matières, les paliers de budget et les lieux alternatifs que personne ne vous montrera.","editorial":{"paragraphes":[{"titre":"Le lieu","texte":"Ce type de lieu n’appartient à personne : il faut donc négocier des créneaux et accepter les passants dans le cadre. Beaucoup de photographes y voient un avantage."},{"titre":"Le moment","texte":"Une cérémonie se joue sur un axe et sur le silence. Plus le décor est fort (nef, verrière, mur plein), plus le reste doit être retiré. Ce qu’il faut prévoir : un axe, du silence, un fond qui ne concurrence pas. Le coffret retient aussi les préparatifs : de la place, de la lumière stable et personne dans le cadre."},{"titre":"La lumière","texte":"Le 23 février, le soleil se lève à 07 h 44 et se couche à 18 h 18 : 10 h 34 de jour, golden hour à partir de 17 h 18. Journée moyenne : la golden hour arrive tôt dans la soirée, c’est la fenêtre à réserver pour les photos."}],"statut":"PROPOSÉ"},"lumiere":{"date":"2026-02-23","lever":"07:44","coucher":"18:18","dureeJour":"10 h 34","goldenHourDebut":"17:18","heureBleueDebut":"18:52","heureBleueFin":"07:11","midiSolaire":"13:01","declinaison":-9.7,"courbe":[0,0,0,0,0,0,0,0,3,17,29,39,45,48,46,39,29,17,3,0,0,0,0,0],"phrase":"Le 23 février, le soleil se lève à 07 h 44 et se couche à 18 h 18 : 10 h 34 de jour, golden hour à partir de 17 h 18.","methode":"calcul solaire NOAA simplifié","reference":"point de référence Lille 50.633 N / 3.067 E","precision":"± 1 à 3 minutes","status":"CALCULÉ"},"pratique":{"statut":"À VÉRIFIER","aVerifierRef":"typologie + standard du territoire"},"reperesDemo":{"budgetMontant":28000,"prestataires":16,"invites":40,"pages":23,"statut":"PROPOSÉ"},"lieuxAssocies":["L-001","L-002"],"coffretsLies":["C-011","C-075","C-196","C-271"],"art":{"hue":199,"sat":60,"light":12,"motif":"p0","methode":"génération déterministe (aucune image)","statut":"VÉRIFIÉ"},"mediaIds":["M-C-054-01"],"sources":[],"statut":"PROPOSÉ"}