{"id":"C-329","numero":329,"titre":"Acier & Cuivre","communeId":"CM-03","lieuId":"L-018","categorieId":"CAT-01","saisonId":"SA-04","moments":["MO-07","MO-06"],"calendrier":{"jour":329,"jourDuMois":25,"mois":10,"annee":2026,"statut":"VÉRIFIÉ"},"tags":["Fumée","Loft","Atelier"],"accroche":"Ce que Hôtel de ville de Tourcoing permet d’imaginer, à Tourcoing.","texte":"Hôtel de ville de Tourcoing — Tourcoing. Murs de brique rouge, fumée douce, lumière rasante de fin d’après-midi. Un objet éditorial pensé comme un plan-séquence : moodboard, repérages photo, timing de cérémonie et adresses 100 % métropole.","editorial":{"paragraphes":[{"titre":"Le lieu","texte":"Ce genre d’architecture fixe déjà la palette (pierre, brique, boiseries, parquets). La piste éditoriale est inverse de l’habitude : retirer plutôt qu’ajouter, et laisser les volumes tenir la mise en scène."},{"titre":"Le moment","texte":"La soirée est le moment qui négocie le plus avec le lieu : puissance, horaires, voisinage. À traiter très en amont. Ce qu’il faut prévoir : de la puissance électrique, des murs épais, un voisinage conciliant. Le coffret retient aussi les discours : un point focal, un micro, une lumière qui isole."},{"titre":"La lumière","texte":"Le 25 novembre, le soleil se lève à 08 h 19 et se couche à 16 h 51 : 8 h 32 de jour, golden hour à partir de 15 h 51. Journée courte : tout ce qui doit être photographié dehors doit l’être avant la golden hour, sinon il fera nuit."}],"statut":"PROPOSÉ"},"lumiere":{"date":"2026-11-25","lever":"08:19","coucher":"16:51","dureeJour":"8 h 32","goldenHourDebut":"15:51","heureBleueDebut":"17:28","heureBleueFin":"07:41","midiSolaire":"12:35","declinaison":-20.8,"courbe":[0,0,0,0,0,0,0,0,0,7,18,25,29,30,26,19,9,0,0,0,0,0,0,0],"phrase":"Le 25 novembre, le soleil se lève à 08 h 19 et se couche à 16 h 51 : 8 h 32 de jour, golden hour à partir de 15 h 51.","methode":"calcul solaire NOAA simplifié","reference":"point de référence Lille 50.633 N / 3.067 E","precision":"± 1 à 3 minutes","status":"CALCULÉ"},"pratique":{"statut":"À VÉRIFIER","aVerifierRef":"typologie + standard du territoire"},"reperesDemo":{"budgetMontant":11000,"prestataires":9,"invites":170,"pages":23,"statut":"PROPOSÉ"},"lieuxAssocies":["L-022","L-017"],"coffretsLies":["C-323","C-330","C-077","C-155"],"art":{"hue":4,"sat":55,"light":9,"motif":"p5","methode":"génération déterministe (aucune image)","statut":"VÉRIFIÉ"},"mediaIds":["M-C-329-01"],"sources":[],"statut":"PROPOSÉ"}