{"id":"C-173","numero":173,"titre":"Canal & Lin","communeId":"CM-01","lieuId":"L-001","categorieId":"CAT-02","saisonId":"SA-03","moments":["MO-09","MO-04"],"calendrier":{"jour":173,"jourDuMois":22,"mois":5,"annee":2026,"statut":"VÉRIFIÉ"},"tags":["Péniche","Reflets","Brume"],"accroche":"Ce que Gare Saint-Sauveur permet d’imaginer, à Lille.","texte":"Le décor : Gare Saint-Sauveur, Lille. Reflets d’eau, passerelles d’acier, brume du matin sur la Deûle. Nous avons suivi les équipes du premier café au dernier verre, et tout consigné dans ce coffret numéroté.","editorial":{"paragraphes":[{"titre":"Le lieu","texte":"Ce type de lieu a ses propres règles (technique, programmation, sécurité). Ce n’est pas un frein : c’est ce qui garantit une acoustique et une lumière maîtrisées."},{"titre":"Le moment","texte":"La séance photo est le seul moment qui se planifie à la minute : la fenêtre de lumière est courte et ne se rattrape pas. Ce qu’il faut prévoir : de l’heure dorée, des matières, de la profondeur. Le coffret retient aussi le cocktail : de la circulation, des zones debout, un extérieur si possible."},{"titre":"La lumière","texte":"Le 22 juin, le soleil se lève à 05 h 35 et se couche à 22 h 04 : 16 h 29 de jour, golden hour à partir de 21 h 04. Journée longue : le cocktail peut commencer avant le coucher du soleil et il restera de la lumière pour la séance photo."}],"statut":"PROPOSÉ"},"lumiere":{"date":"2026-06-22","lever":"05:35","coucher":"22:04","dureeJour":"16 h 29","goldenHourDebut":"21:04","heureBleueDebut":"22:50","heureBleueFin":"04:50","midiSolaire":"13:50","declinaison":23.4,"courbe":[0,0,0,0,0,0,4,17,31,47,62,77,89,99,101,96,85,72,57,41,26,12,0,0],"phrase":"Le 22 juin, le soleil se lève à 05 h 35 et se couche à 22 h 04 : 16 h 29 de jour, golden hour à partir de 21 h 04.","methode":"calcul solaire NOAA simplifié","reference":"point de référence Lille 50.633 N / 3.067 E","precision":"± 1 à 3 minutes","status":"CALCULÉ"},"pratique":{"statut":"À VÉRIFIER","aVerifierRef":"typologie + standard du territoire"},"reperesDemo":{"budgetMontant":10000,"prestataires":19,"invites":180,"pages":22,"statut":"PROPOSÉ"},"lieuxAssocies":["L-004","L-005"],"coffretsLies":["C-259","C-163","C-187","C-275"],"art":{"hue":188,"sat":48,"light":13,"motif":"p5","methode":"génération déterministe (aucune image)","statut":"VÉRIFIÉ"},"mediaIds":["M-C-173-01"],"sources":[],"statut":"PROPOSÉ"}