{"id":"C-362","numero":362,"titre":"Citadelle & Brume","communeId":"CM-01","lieuId":"L-008","categorieId":"CAT-04","saisonId":"SA-01","moments":["MO-08","MO-01"],"calendrier":{"jour":362,"jourDuMois":28,"mois":11,"annee":2026,"statut":"VÉRIFIÉ"},"tags":["Jardin","Fougère","Houblon"],"accroche":"Un coffret ancré à Jardin des Plantes, Lille, dans l’univers « Végétal Brut ».","texte":"Le décor : Jardin des Plantes, Lille. Serres, houblon, fougères et lin brut froissé. Nous avons suivi les équipes du premier café au dernier verre, et tout consigné dans ce coffret numéroté.","editorial":{"paragraphes":[{"titre":"Le lieu","texte":"Le végétal demande une chose : de la patience de repérage. Ce qui rend le décor intéressant, c’est la limite — l’allée, la lisière, le muret — pas le centre du parc."},{"titre":"Le moment","texte":"Le brunch profite de ce que personne ne remarque : la lumière de fin de matinée et un extérieur qui n’a pas été rangé pour la soirée. Ce qu’il faut prévoir : un extérieur, une lumière douce, un service simple. Le coffret retient aussi les préparatifs : de la place, de la lumière stable et personne dans le cadre."},{"titre":"La lumière","texte":"Le 28 décembre, le soleil se lève à 08 h 49 et se couche à 16 h 50 : 8 h 00 de jour, golden hour à partir de 15 h 50. Journée courte : tout ce qui doit être photographié dehors doit l’être avant la golden hour, sinon il fera nuit."}],"statut":"PROPOSÉ"},"lumiere":{"date":"2026-12-28","lever":"08:49","coucher":"16:50","dureeJour":"8 h 00","goldenHourDebut":"15:50","heureBleueDebut":"17:29","heureBleueFin":"08:10","midiSolaire":"12:49","declinaison":-23.3,"courbe":[0,0,0,0,0,0,0,0,0,1,12,20,25,26,23,17,8,0,0,0,0,0,0,0],"phrase":"Le 28 décembre, le soleil se lève à 08 h 49 et se couche à 16 h 50 : 8 h 00 de jour, golden hour à partir de 15 h 50.","methode":"calcul solaire NOAA simplifié","reference":"point de référence Lille 50.633 N / 3.067 E","precision":"± 1 à 3 minutes","status":"CALCULÉ"},"pratique":{"statut":"À VÉRIFIER","aVerifierRef":"typologie + standard du territoire"},"reperesDemo":{"budgetMontant":30000,"prestataires":20,"invites":190,"pages":22,"statut":"PROPOSÉ"},"lieuxAssocies":["L-003","L-004"],"coffretsLies":["C-363","C-025","C-114","C-238"],"art":{"hue":126,"sat":40,"light":9,"motif":"p2","methode":"génération déterministe (aucune image)","statut":"VÉRIFIÉ"},"mediaIds":["M-C-362-01"],"sources":[],"statut":"PROPOSÉ"}