{"id":"C-099","numero":99,"titre":"Canal & Sucre","communeId":"CM-08","lieuId":"L-040","categorieId":"CAT-03","saisonId":"SA-02","moments":["MO-05","MO-02"],"calendrier":{"jour":99,"jourDuMois":9,"mois":3,"annee":2026,"statut":"VÉRIFIÉ"},"tags":["Néon","Dancefloor","Nuit"],"accroche":"Ce que Rives de la Marque permet d’imaginer, à Wasquehal.","texte":"Le décor : Rives de la Marque, Wasquehal. Néons, béton brut, pluie fine sur l’asphalte et dancefloor jusqu’au dernier tram. Nous avons suivi les équipes du premier café au dernier verre, et tout consigné dans ce coffret numéroté.","editorial":{"paragraphes":[{"titre":"Le lieu","texte":"Un bord d’eau cadre naturellement les groupes : la berge donne une ligne, le reflet donne la profondeur. Reste à savoir à quelle heure le vent tombe — c’est là que l’eau devient un miroir."},{"titre":"Le moment","texte":"Le dîner est le moment le plus technique : acoustique, service, cheminement des assiettes. Un volume industriel absorbe mieux le bruit qu’un beau parquet. Ce qu’il faut prévoir : des tables, de l’acoustique, de la hauteur sous plafond. Le coffret retient aussi la mairie : un créneau court, une adresse claire, des photos de sortie."},{"titre":"La lumière","texte":"Le 9 avril, le soleil se lève à 07 h 06 et se couche à 20 h 33 : 13 h 27 de jour, golden hour à partir de 19 h 33. Journée moyenne : la golden hour arrive tôt dans la soirée, c’est la fenêtre à réserver pour les photos."}],"statut":"PROPOSÉ"},"lumiere":{"date":"2026-04-09","lever":"07:06","coucher":"20:33","dureeJour":"13 h 27","goldenHourDebut":"19:33","heureBleueDebut":"21:07","heureBleueFin":"06:32","midiSolaire":"13:49","declinaison":7.7,"courbe":[0,0,0,0,0,0,0,0,12,28,42,56,67,74,76,72,63,51,37,22,7,0,0,0],"phrase":"Le 9 avril, le soleil se lève à 07 h 06 et se couche à 20 h 33 : 13 h 27 de jour, golden hour à partir de 19 h 33.","methode":"calcul solaire NOAA simplifié","reference":"point de référence Lille 50.633 N / 3.067 E","precision":"± 1 à 3 minutes","status":"CALCULÉ"},"pratique":{"statut":"À VÉRIFIER","aVerifierRef":"typologie + standard du territoire"},"reperesDemo":{"budgetMontant":12000,"prestataires":22,"invites":180,"pages":13,"statut":"PROPOSÉ"},"lieuxAssocies":["L-039","L-038"],"coffretsLies":["C-078","C-115","C-026","C-084"],"art":{"hue":309,"sat":78,"light":10,"motif":"p3","methode":"génération déterministe (aucune image)","statut":"VÉRIFIÉ"},"mediaIds":["M-C-099-01"],"sources":[],"statut":"PROPOSÉ"}