{"id":"C-118","numero":118,"titre":"Béguinage & Lumière","communeId":"CM-05","lieuId":"L-030","categorieId":"CAT-06","saisonId":"SA-02","moments":["MO-05","MO-04"],"calendrier":{"jour":118,"jourDuMois":28,"mois":3,"annee":2026,"statut":"VÉRIFIÉ"},"tags":["Baroque","Velours","Or patiné"],"accroche":"Un coffret ancré à Quai des Flandres, Marcq-en-Barœul, dans l’univers « Or & Velours ».","texte":"On entre par Quai des Flandres, à Marcq-en-Barœul. Velours profond, laiton poli, bougies et or patiné. Le coffret déroule douze pages d’inspiration, la carte des lumières heure par heure et l’annuaire des artisans qui tiennent la journée debout.","editorial":{"paragraphes":[{"titre":"Le lieu","texte":"Un bord d’eau cadre naturellement les groupes : la berge donne une ligne, le reflet donne la profondeur. Reste à savoir à quelle heure le vent tombe — c’est là que l’eau devient un miroir."},{"titre":"Le moment","texte":"Le dîner est le moment le plus technique : acoustique, service, cheminement des assiettes. Un volume industriel absorbe mieux le bruit qu’un beau parquet. Ce qu’il faut prévoir : des tables, de l’acoustique, de la hauteur sous plafond. Le coffret retient aussi le cocktail : de la circulation, des zones debout, un extérieur si possible."},{"titre":"La lumière","texte":"Le 28 avril, le soleil se lève à 06 h 27 et se couche à 21 h 03 : 14 h 36 de jour, golden hour à partir de 20 h 03. Journée longue : le cocktail peut commencer avant le coucher du soleil et il restera de la lumière pour la séance photo."}],"statut":"PROPOSÉ"},"lumiere":{"date":"2026-04-28","lever":"06:27","coucher":"21:03","dureeJour":"14 h 36","goldenHourDebut":"20:03","heureBleueDebut":"21:40","heureBleueFin":"05:51","midiSolaire":"13:45","declinaison":14.2,"courbe":[0,0,0,0,0,0,0,6,21,37,52,66,77,85,86,82,72,59,44,29,14,0,0,0],"phrase":"Le 28 avril, le soleil se lève à 06 h 27 et se couche à 21 h 03 : 14 h 36 de jour, golden hour à partir de 20 h 03.","methode":"calcul solaire NOAA simplifié","reference":"point de référence Lille 50.633 N / 3.067 E","precision":"± 1 à 3 minutes","status":"CALCULÉ"},"pratique":{"statut":"À VÉRIFIER","aVerifierRef":"typologie + standard du territoire"},"reperesDemo":{"budgetMontant":13000,"prestataires":23,"invites":190,"pages":23,"statut":"PROPOSÉ"},"lieuxAssocies":["L-029","L-031"],"coffretsLies":["C-046","C-065","C-364","C-102"],"art":{"hue":45,"sat":75,"light":8,"motif":"p4","methode":"génération déterministe (aucune image)","statut":"VÉRIFIÉ"},"mediaIds":["M-C-118-01"],"sources":[],"statut":"PROPOSÉ"}