{"id":"C-321","numero":321,"titre":"Acier & Brume","communeId":"CM-04","lieuId":"L-024","categorieId":"CAT-04","saisonId":"SA-04","moments":["MO-04","MO-03"],"calendrier":{"jour":321,"jourDuMois":17,"mois":10,"annee":2026,"statut":"VÉRIFIÉ"},"tags":["Jardin","Lin","Serre"],"accroche":"Ce que LaM, parc de sculptures permet d’imaginer, à Villeneuve-d’Ascq.","texte":"LaM, parc de sculptures — Villeneuve-d’Ascq. Serres, houblon, fougères et lin brut froissé. Un objet éditorial pensé comme un plan-séquence : moodboard, repérages photo, timing de cérémonie et adresses 100 % métropole.","editorial":{"paragraphes":[{"titre":"Le lieu","texte":"Ce type de lieu a ses propres règles (technique, programmation, sécurité). Ce n’est pas un frein : c’est ce qui garantit une acoustique et une lumière maîtrisées."},{"titre":"Le moment","texte":"Le cocktail est le moment le plus dépendant de la météo et de la lumière : c’est là qu’un extérieur, même modeste, change tout. Ce qu’il faut prévoir : de la circulation, des zones debout, un extérieur si possible. Le coffret retient aussi la cérémonie : un axe, du silence, un fond qui ne concurrence pas."},{"titre":"La lumière","texte":"Le 17 novembre, le soleil se lève à 08 h 06 et se couche à 16 h 59 : 8 h 53 de jour, golden hour à partir de 15 h 59. Journée courte : tout ce qui doit être photographié dehors doit l’être avant la golden hour, sinon il fera nuit."}],"statut":"PROPOSÉ"},"lumiere":{"date":"2026-11-17","lever":"08:06","coucher":"16:59","dureeJour":"8 h 53","goldenHourDebut":"15:59","heureBleueDebut":"17:36","heureBleueFin":"07:30","midiSolaire":"12:33","declinaison":-19.1,"courbe":[0,0,0,0,0,0,0,0,0,10,20,28,32,32,29,21,11,0,0,0,0,0,0,0],"phrase":"Le 17 novembre, le soleil se lève à 08 h 06 et se couche à 16 h 59 : 8 h 53 de jour, golden hour à partir de 15 h 59.","methode":"calcul solaire NOAA simplifié","reference":"point de référence Lille 50.633 N / 3.067 E","precision":"± 1 à 3 minutes","status":"CALCULÉ"},"pratique":{"statut":"À VÉRIFIER","aVerifierRef":"typologie + standard du territoire"},"reperesDemo":{"budgetMontant":23000,"prestataires":20,"invites":70,"pages":16,"statut":"PROPOSÉ"},"lieuxAssocies":["L-025","L-026"],"coffretsLies":["C-303","C-268","C-333","C-357"],"art":{"hue":127,"sat":44,"light":8,"motif":"p3","methode":"génération déterministe (aucune image)","statut":"VÉRIFIÉ"},"mediaIds":["M-C-321-01"],"sources":[],"statut":"PROPOSÉ"}