{"id":"C-155","numero":155,"titre":"Beffroi & Fumée","communeId":"CM-03","lieuId":"L-018","categorieId":"CAT-03","saisonId":"SA-03","moments":["MO-06","MO-10"],"calendrier":{"jour":155,"jourDuMois":4,"mois":5,"annee":2026,"statut":"VÉRIFIÉ"},"tags":["Dancefloor","Néon","Béton"],"accroche":"Ce que Hôtel de ville de Tourcoing permet d’imaginer, à Tourcoing.","texte":"Dix heures de mariage en immersion à Tourcoing, depuis Hôtel de ville de Tourcoing. Néons, béton brut, pluie fine sur l’asphalte et dancefloor jusqu’au dernier tram. À l’intérieur, les matières, les paliers de budget et les lieux alternatifs que personne ne vous montrera.","editorial":{"paragraphes":[{"titre":"Le lieu","texte":"Ce genre d’architecture fixe déjà la palette (pierre, brique, boiseries, parquets). La piste éditoriale est inverse de l’habitude : retirer plutôt qu’ajouter, et laisser les volumes tenir la mise en scène."},{"titre":"Le moment","texte":"Les discours tiennent à trois choses : un endroit où se mettre, une lumière qui isole et une acoustique qui pardonne. Ce qu’il faut prévoir : un point focal, un micro, une lumière qui isole. Le coffret retient aussi le repérage : du temps, un accès libre, une seconde visite à la bonne heure."},{"titre":"La lumière","texte":"Le 4 juin, le soleil se lève à 05 h 38 et se couche à 21 h 54 : 16 h 15 de jour, golden hour à partir de 20 h 54. Journée longue : le cocktail peut commencer avant le coucher du soleil et il restera de la lumière pour la séance photo."}],"statut":"PROPOSÉ"},"lumiere":{"date":"2026-06-04","lever":"05:38","coucher":"21:54","dureeJour":"16 h 15","goldenHourDebut":"20:54","heureBleueDebut":"22:38","heureBleueFin":"04:54","midiSolaire":"13:46","declinaison":22.5,"courbe":[0,0,0,0,0,0,3,17,31,46,62,76,89,97,100,94,83,70,55,39,24,10,0,0],"phrase":"Le 4 juin, le soleil se lève à 05 h 38 et se couche à 21 h 54 : 16 h 15 de jour, golden hour à partir de 20 h 54.","methode":"calcul solaire NOAA simplifié","reference":"point de référence Lille 50.633 N / 3.067 E","precision":"± 1 à 3 minutes","status":"CALCULÉ"},"pratique":{"statut":"À VÉRIFIER","aVerifierRef":"typologie + standard du territoire"},"reperesDemo":{"budgetMontant":19000,"prestataires":12,"invites":190,"pages":23,"statut":"PROPOSÉ"},"lieuxAssocies":["L-017","L-019"],"coffretsLies":["C-323","C-356","C-162","C-169"],"art":{"hue":308,"sat":73,"light":9,"motif":"p5","methode":"génération déterministe (aucune image)","statut":"VÉRIFIÉ"},"mediaIds":["M-C-155-01"],"sources":[],"statut":"PROPOSÉ"}