{"id":"C-310","numero":310,"titre":"Tramway & Néon","communeId":"CM-04","lieuId":"L-027","categorieId":"CAT-03","saisonId":"SA-04","moments":["MO-07","MO-06"],"calendrier":{"jour":310,"jourDuMois":6,"mois":10,"annee":2026,"statut":"VÉRIFIÉ"},"tags":["Béton","Néon","Pluie"],"accroche":"Un coffret ancré à Lac du Héron, Villeneuve-d’Ascq, dans l’univers « Néon Urbain ».","texte":"Le décor : Lac du Héron, Villeneuve-d’Ascq. Néons, béton brut, pluie fine sur l’asphalte et dancefloor jusqu’au dernier tram. Nous avons suivi les équipes du premier café au dernier verre, et tout consigné dans ce coffret numéroté.","editorial":{"paragraphes":[{"titre":"Le lieu","texte":"Un bord d’eau cadre naturellement les groupes : la berge donne une ligne, le reflet donne la profondeur. Reste à savoir à quelle heure le vent tombe — c’est là que l’eau devient un miroir."},{"titre":"Le moment","texte":"La soirée est le moment qui négocie le plus avec le lieu : puissance, horaires, voisinage. À traiter très en amont. Ce qu’il faut prévoir : de la puissance électrique, des murs épais, un voisinage conciliant. Le coffret retient aussi les discours : un point focal, un micro, une lumière qui isole."},{"titre":"La lumière","texte":"Le 6 novembre, le soleil se lève à 07 h 48 et se couche à 17 h 15 : 9 h 27 de jour, golden hour à partir de 16 h 15. Journée courte : tout ce qui doit être photographié dehors doit l’être avant la golden hour, sinon il fera nuit."}],"statut":"PROPOSÉ"},"lumiere":{"date":"2026-11-06","lever":"07:48","coucher":"17:15","dureeJour":"9 h 27","goldenHourDebut":"16:15","heureBleueDebut":"17:50","heureBleueFin":"07:13","midiSolaire":"12:31","declinaison":-16.1,"courbe":[0,0,0,0,0,0,0,0,1,14,25,33,37,37,33,25,15,2,0,0,0,0,0,0],"phrase":"Le 6 novembre, le soleil se lève à 07 h 48 et se couche à 17 h 15 : 9 h 27 de jour, golden hour à partir de 16 h 15.","methode":"calcul solaire NOAA simplifié","reference":"point de référence Lille 50.633 N / 3.067 E","precision":"± 1 à 3 minutes","status":"CALCULÉ"},"pratique":{"statut":"À VÉRIFIER","aVerifierRef":"typologie + standard du territoire"},"reperesDemo":{"budgetMontant":24000,"prestataires":14,"invites":60,"pages":22,"statut":"PROPOSÉ"},"lieuxAssocies":["L-025","L-026"],"coffretsLies":["C-302","C-083","C-225","C-333"],"art":{"hue":319,"sat":76,"light":9,"motif":"p4","methode":"génération déterministe (aucune image)","statut":"VÉRIFIÉ"},"mediaIds":["M-C-310-01"],"sources":[],"statut":"PROPOSÉ"}