{"id":"C-234","numero":234,"titre":"Acier & Or","communeId":"CM-01","lieuId":"L-009","categorieId":"CAT-04","saisonId":"SA-03","moments":["MO-04","MO-09"],"calendrier":{"jour":234,"jourDuMois":22,"mois":7,"annee":2026,"statut":"VÉRIFIÉ"},"tags":["Jardin","Fougère","Houblon"],"accroche":"Un coffret ancré à Wazemmes, marché de nuit, Lille, dans l’univers « Végétal Brut ».","texte":"Le décor : Wazemmes, marché de nuit, Lille. Serres, houblon, fougères et lin brut froissé. Nous avons suivi les équipes du premier café au dernier verre, et tout consigné dans ce coffret numéroté.","editorial":{"paragraphes":[{"titre":"Le lieu","texte":"Ce qui fait la force d’un lieu public, c’est la vie qui continue autour. Ce qui fait sa difficulté, c’est qu’elle ne s’interrompt pas."},{"titre":"Le moment","texte":"Le cocktail est le moment le plus dépendant de la météo et de la lumière : c’est là qu’un extérieur, même modeste, change tout. Ce qu’il faut prévoir : de la circulation, des zones debout, un extérieur si possible. Le coffret retient aussi la séance photo : de l’heure dorée, des matières, de la profondeur."},{"titre":"La lumière","texte":"Le 22 août, le soleil se lève à 06 h 47 et se couche à 20 h 55 : 14 h 08 de jour, golden hour à partir de 19 h 55. Journée longue : le cocktail peut commencer avant le coucher du soleil et il restera de la lumière pour la séance photo."}],"statut":"PROPOSÉ"},"lumiere":{"date":"2026-08-22","lever":"06:47","coucher":"20:55","dureeJour":"14 h 08","goldenHourDebut":"19:55","heureBleueDebut":"21:30","heureBleueFin":"06:11","midiSolaire":"13:51","declinaison":11.7,"courbe":[0,0,0,0,0,0,0,2,17,32,47,61,73,80,82,78,69,57,43,27,12,0,0,0],"phrase":"Le 22 août, le soleil se lève à 06 h 47 et se couche à 20 h 55 : 14 h 08 de jour, golden hour à partir de 19 h 55.","methode":"calcul solaire NOAA simplifié","reference":"point de référence Lille 50.633 N / 3.067 E","precision":"± 1 à 3 minutes","status":"CALCULÉ"},"pratique":{"statut":"À VÉRIFIER","aVerifierRef":"typologie + standard du territoire"},"reperesDemo":{"budgetMontant":20000,"prestataires":22,"invites":180,"pages":23,"statut":"PROPOSÉ"},"lieuxAssocies":["L-001","L-002"],"coffretsLies":["C-242","C-150","C-185","C-229"],"art":{"hue":135,"sat":41,"light":11,"motif":"p0","methode":"génération déterministe (aucune image)","statut":"VÉRIFIÉ"},"mediaIds":["M-C-234-01"],"sources":[],"statut":"PROPOSÉ"}