{"id":"C-349","numero":349,"titre":"Grand-Place & Pluie","communeId":"CM-02","lieuId":"L-013","categorieId":"CAT-02","saisonId":"SA-01","moments":["MO-04","MO-01"],"calendrier":{"jour":349,"jourDuMois":15,"mois":11,"annee":2026,"statut":"VÉRIFIÉ"},"tags":["Reflets","Péniche","Brume"],"accroche":"Ce que Piscine Art déco permet d’imaginer, à Roubaix.","texte":"Piscine Art déco — Roubaix. Reflets d’eau, passerelles d’acier, brume du matin sur la Deûle. Un objet éditorial pensé comme un plan-séquence : moodboard, repérages photo, timing de cérémonie et adresses 100 % métropole.","editorial":{"paragraphes":[{"titre":"Le lieu","texte":"Les gradins sont une tribune au sens propre. C’est un décor très efficace pour un dîner en contrebas, et une acoustique à tester avant de promettre quoi que ce soit."},{"titre":"Le moment","texte":"Le cocktail est le moment le plus dépendant de la météo et de la lumière : c’est là qu’un extérieur, même modeste, change tout. Ce qu’il faut prévoir : de la circulation, des zones debout, un extérieur si possible. Le coffret retient aussi les préparatifs : de la place, de la lumière stable et personne dans le cadre."},{"titre":"La lumière","texte":"Le 15 décembre, le soleil se lève à 08 h 43 et se couche à 16 h 43 : 8 h 00 de jour, golden hour à partir de 15 h 43. Journée courte : tout ce qui doit être photographié dehors doit l’être avant la golden hour, sinon il fera nuit."}],"statut":"PROPOSÉ"},"lumiere":{"date":"2026-12-15","lever":"08:43","coucher":"16:43","dureeJour":"8 h 00","goldenHourDebut":"15:43","heureBleueDebut":"17:22","heureBleueFin":"08:04","midiSolaire":"12:43","declinaison":-23.3,"courbe":[0,0,0,0,0,0,0,0,0,2,13,20,25,26,23,16,7,0,0,0,0,0,0,0],"phrase":"Le 15 décembre, le soleil se lève à 08 h 43 et se couche à 16 h 43 : 8 h 00 de jour, golden hour à partir de 15 h 43.","methode":"calcul solaire NOAA simplifié","reference":"point de référence Lille 50.633 N / 3.067 E","precision":"± 1 à 3 minutes","status":"CALCULÉ"},"pratique":{"statut":"À VÉRIFIER","aVerifierRef":"typologie + standard du territoire"},"reperesDemo":{"budgetMontant":21000,"prestataires":12,"invites":150,"pages":14,"statut":"PROPOSÉ"},"lieuxAssocies":["L-016","L-011"],"coffretsLies":["C-105","C-116","C-358","C-008"],"art":{"hue":179,"sat":48,"light":12,"motif":"p1","methode":"génération déterministe (aucune image)","statut":"VÉRIFIÉ"},"mediaIds":["M-C-349-01"],"sources":[],"statut":"PROPOSÉ"}