{"id":"C-229","numero":229,"titre":"Grand-Place & Zinc","communeId":"CM-01","lieuId":"L-009","categorieId":"CAT-06","saisonId":"SA-03","moments":["MO-05","MO-02"],"calendrier":{"jour":229,"jourDuMois":17,"mois":7,"annee":2026,"statut":"VÉRIFIÉ"},"tags":["Bougies","Baroque","Velours"],"accroche":"Ce que Wazemmes, marché de nuit permet d’imaginer, à Lille.","texte":"Dix heures de mariage en immersion à Lille, depuis Wazemmes, marché de nuit. Velours profond, laiton poli, bougies et or patiné. À l’intérieur, les matières, les paliers de budget et les lieux alternatifs que personne ne vous montrera.","editorial":{"paragraphes":[{"titre":"Le lieu","texte":"Ce qui fait la force d’un lieu public, c’est la vie qui continue autour. Ce qui fait sa difficulté, c’est qu’elle ne s’interrompt pas."},{"titre":"Le moment","texte":"Le dîner est le moment le plus technique : acoustique, service, cheminement des assiettes. Un volume industriel absorbe mieux le bruit qu’un beau parquet. Ce qu’il faut prévoir : des tables, de l’acoustique, de la hauteur sous plafond. Le coffret retient aussi la mairie : un créneau court, une adresse claire, des photos de sortie."},{"titre":"La lumière","texte":"Le 17 août, le soleil se lève à 06 h 39 et se couche à 21 h 05 : 14 h 25 de jour, golden hour à partir de 20 h 05. Journée longue : le cocktail peut commencer avant le coucher du soleil et il restera de la lumière pour la séance photo."}],"statut":"PROPOSÉ"},"lumiere":{"date":"2026-08-17","lever":"06:39","coucher":"21:05","dureeJour":"14 h 25","goldenHourDebut":"20:05","heureBleueDebut":"21:41","heureBleueFin":"06:03","midiSolaire":"13:52","declinaison":13.3,"courbe":[0,0,0,0,0,0,0,4,19,34,49,63,75,83,85,81,72,59,45,30,14,0,0,0],"phrase":"Le 17 août, le soleil se lève à 06 h 39 et se couche à 21 h 05 : 14 h 25 de jour, golden hour à partir de 20 h 05.","methode":"calcul solaire NOAA simplifié","reference":"point de référence Lille 50.633 N / 3.067 E","precision":"± 1 à 3 minutes","status":"CALCULÉ"},"pratique":{"statut":"À VÉRIFIER","aVerifierRef":"typologie + standard du territoire"},"reperesDemo":{"budgetMontant":20000,"prestataires":21,"invites":190,"pages":19,"statut":"PROPOSÉ"},"lieuxAssocies":["L-005","L-006"],"coffretsLies":["C-153","C-242","C-234","C-061"],"art":{"hue":50,"sat":75,"light":8,"motif":"p1","methode":"génération déterministe (aucune image)","statut":"VÉRIFIÉ"},"mediaIds":["M-C-229-01"],"sources":[],"statut":"PROPOSÉ"}