{"id":"C-336","numero":336,"titre":"Béguinage & Sucre","communeId":"CM-08","lieuId":"L-039","categorieId":"CAT-05","saisonId":"SA-01","moments":["MO-01","MO-05"],"calendrier":{"jour":336,"jourDuMois":2,"mois":11,"annee":2026,"statut":"VÉRIFIÉ"},"tags":["Graphique","Architecture","Minimal"],"accroche":"Un coffret ancré à Bois de la Houssière, Wasquehal, dans l’univers « Béton Contemporain ».","texte":"Bois de la Houssière — Wasquehal. Lignes nettes, béton ciré, blanc absolu et ombres graphiques. Un objet éditorial pensé comme un plan-séquence : moodboard, repérages photo, timing de cérémonie et adresses 100 % métropole.","editorial":{"paragraphes":[{"titre":"Le lieu","texte":"Le végétal demande une chose : de la patience de repérage. Ce qui rend le décor intéressant, c’est la limite — l’allée, la lisière, le muret — pas le centre du parc."},{"titre":"Le moment","texte":"Les préparatifs demandent surtout un lieu qui ne bouge pas : même lumière, même fond, deux heures durant. Un décor sobre tient mieux qu’un décor spectaculaire. Ce qu’il faut prévoir : de la place, de la lumière stable et personne dans le cadre. Le coffret retient aussi le dîner : des tables, de l’acoustique, de la hauteur sous plafond."},{"titre":"La lumière","texte":"Le 2 décembre, le soleil se lève à 08 h 29 et se couche à 16 h 46 : 8 h 17 de jour, golden hour à partir de 15 h 46. Journée courte : tout ce qui doit être photographié dehors doit l’être avant la golden hour, sinon il fera nuit."}],"statut":"PROPOSÉ"},"lumiere":{"date":"2026-12-02","lever":"08:29","coucher":"16:46","dureeJour":"8 h 17","goldenHourDebut":"15:46","heureBleueDebut":"17:24","heureBleueFin":"07:50","midiSolaire":"12:37","declinaison":-22,"courbe":[0,0,0,0,0,0,0,0,0,5,15,23,27,28,24,17,8,0,0,0,0,0,0,0],"phrase":"Le 2 décembre, le soleil se lève à 08 h 29 et se couche à 16 h 46 : 8 h 17 de jour, golden hour à partir de 15 h 46.","methode":"calcul solaire NOAA simplifié","reference":"point de référence Lille 50.633 N / 3.067 E","precision":"± 1 à 3 minutes","status":"CALCULÉ"},"pratique":{"statut":"À VÉRIFIER","aVerifierRef":"typologie + standard du territoire"},"reperesDemo":{"budgetMontant":26000,"prestataires":16,"invites":100,"pages":26,"statut":"PROPOSÉ"},"lieuxAssocies":["L-038","L-040"],"coffretsLies":["C-053","C-139","C-301","C-082"],"art":{"hue":217,"sat":9,"light":9,"motif":"p0","methode":"génération déterministe (aucune image)","statut":"VÉRIFIÉ"},"mediaIds":["M-C-336-01"],"sources":[],"statut":"PROPOSÉ"}