{"id":"C-345","numero":345,"titre":"Brique & Papier","communeId":"CM-01","lieuId":"L-006","categorieId":"CAT-01","saisonId":"SA-01","moments":["MO-09","MO-03"],"calendrier":{"jour":345,"jourDuMois":11,"mois":11,"annee":2026,"statut":"VÉRIFIÉ"},"tags":["Industriel","Fumée","Loft"],"accroche":"Ce que Citadelle, bois de Boulogne permet d’imaginer, à Lille.","texte":"Le décor : Citadelle, bois de Boulogne, Lille. Murs de brique rouge, fumée douce, lumière rasante de fin d’après-midi. Nous avons suivi les équipes du premier café au dernier verre, et tout consigné dans ce coffret numéroté.","editorial":{"paragraphes":[{"titre":"Le lieu","texte":"Le végétal demande une chose : de la patience de repérage. Ce qui rend le décor intéressant, c’est la limite — l’allée, la lisière, le muret — pas le centre du parc."},{"titre":"Le moment","texte":"La séance photo est le seul moment qui se planifie à la minute : la fenêtre de lumière est courte et ne se rattrape pas. Ce qu’il faut prévoir : de l’heure dorée, des matières, de la profondeur. Le coffret retient aussi la cérémonie : un axe, du silence, un fond qui ne concurrence pas."},{"titre":"La lumière","texte":"Le 11 décembre, le soleil se lève à 08 h 39 et se couche à 16 h 43 : 8 h 04 de jour, golden hour à partir de 15 h 43. Journée courte : tout ce qui doit être photographié dehors doit l’être avant la golden hour, sinon il fera nuit."}],"statut":"PROPOSÉ"},"lumiere":{"date":"2026-12-11","lever":"08:39","coucher":"16:43","dureeJour":"8 h 04","goldenHourDebut":"15:43","heureBleueDebut":"17:22","heureBleueFin":"08:00","midiSolaire":"12:41","declinaison":-23,"courbe":[0,0,0,0,0,0,0,0,0,3,13,21,25,26,23,16,7,0,0,0,0,0,0,0],"phrase":"Le 11 décembre, le soleil se lève à 08 h 39 et se couche à 16 h 43 : 8 h 04 de jour, golden hour à partir de 15 h 43.","methode":"calcul solaire NOAA simplifié","reference":"point de référence Lille 50.633 N / 3.067 E","precision":"± 1 à 3 minutes","status":"CALCULÉ"},"pratique":{"statut":"À VÉRIFIER","aVerifierRef":"typologie + standard du territoire"},"reperesDemo":{"budgetMontant":19000,"prestataires":11,"invites":90,"pages":14,"statut":"PROPOSÉ"},"lieuxAssocies":["L-004","L-005"],"coffretsLies":["C-355","C-261","C-002","C-035"],"art":{"hue":17,"sat":60,"light":9,"motif":"p3","methode":"génération déterministe (aucune image)","statut":"VÉRIFIÉ"},"mediaIds":["M-C-345-01"],"sources":[],"statut":"PROPOSÉ"}