{"id":"C-211","numero":211,"titre":"Acier & Lin","communeId":"CM-02","lieuId":"L-013","categorieId":"CAT-06","saisonId":"SA-03","moments":["MO-05","MO-04"],"calendrier":{"jour":211,"jourDuMois":30,"mois":6,"annee":2026,"statut":"VÉRIFIÉ"},"tags":["Velours","Or patiné","Laiton"],"accroche":"Ce que Piscine Art déco permet d’imaginer, à Roubaix.","texte":"Dix heures de mariage en immersion à Roubaix, depuis Piscine Art déco. Velours profond, laiton poli, bougies et or patiné. À l’intérieur, les matières, les paliers de budget et les lieux alternatifs que personne ne vous montrera.","editorial":{"paragraphes":[{"titre":"Le lieu","texte":"Les gradins sont une tribune au sens propre. C’est un décor très efficace pour un dîner en contrebas, et une acoustique à tester avant de promettre quoi que ce soit."},{"titre":"Le moment","texte":"Le dîner est le moment le plus technique : acoustique, service, cheminement des assiettes. Un volume industriel absorbe mieux le bruit qu’un beau parquet. Ce qu’il faut prévoir : des tables, de l’acoustique, de la hauteur sous plafond. Le coffret retient aussi le cocktail : de la circulation, des zones debout, un extérieur si possible."},{"titre":"La lumière","texte":"Le 30 juillet, le soleil se lève à 06 h 12 et se couche à 21 h 36 : 15 h 24 de jour, golden hour à partir de 20 h 36. Journée longue : le cocktail peut commencer avant le coucher du soleil et il restera de la lumière pour la séance photo."}],"statut":"PROPOSÉ"},"lumiere":{"date":"2026-07-30","lever":"06:12","coucher":"21:36","dureeJour":"15 h 24","goldenHourDebut":"20:36","heureBleueDebut":"22:16","heureBleueFin":"05:32","midiSolaire":"13:54","declinaison":18.4,"courbe":[0,0,0,0,0,0,0,10,24,40,55,69,82,90,93,89,79,66,52,37,21,7,0,0],"phrase":"Le 30 juillet, le soleil se lève à 06 h 12 et se couche à 21 h 36 : 15 h 24 de jour, golden hour à partir de 20 h 36.","methode":"calcul solaire NOAA simplifié","reference":"point de référence Lille 50.633 N / 3.067 E","precision":"± 1 à 3 minutes","status":"CALCULÉ"},"pratique":{"statut":"À VÉRIFIER","aVerifierRef":"typologie + standard du territoire"},"reperesDemo":{"budgetMontant":26000,"prestataires":14,"invites":90,"pages":25,"statut":"PROPOSÉ"},"lieuxAssocies":["L-012","L-014"],"coffretsLies":["C-122","C-152","C-165","C-183"],"art":{"hue":53,"sat":76,"light":9,"motif":"p1","methode":"génération déterministe (aucune image)","statut":"VÉRIFIÉ"},"mediaIds":["M-C-211-01"],"sources":[],"statut":"PROPOSÉ"}