{"id":"C-224","numero":224,"titre":"Estaminet & Cendre","communeId":"CM-01","lieuId":"L-005","categorieId":"CAT-05","saisonId":"SA-03","moments":["MO-09","MO-05"],"calendrier":{"jour":224,"jourDuMois":12,"mois":7,"annee":2026,"statut":"VÉRIFIÉ"},"tags":["Lignes","Graphique","Minimal"],"accroche":"Un coffret ancré à Euralille, tour Lilleurope, Lille, dans l’univers « Béton Contemporain ».","texte":"On entre par Euralille, tour Lilleurope, à Lille. Lignes nettes, béton ciré, blanc absolu et ombres graphiques. Le coffret déroule douze pages d’inspiration, la carte des lumières heure par heure et l’annuaire des artisans qui tiennent la journée debout.","editorial":{"paragraphes":[{"titre":"Le lieu","texte":"Le verre et l’acier vieillissent visuellement très vite dans une photo de fin de journée. La lumière rasante est ici le meilleur allié."},{"titre":"Le moment","texte":"La séance photo est le seul moment qui se planifie à la minute : la fenêtre de lumière est courte et ne se rattrape pas. Ce qu’il faut prévoir : de l’heure dorée, des matières, de la profondeur. Le coffret retient aussi le dîner : des tables, de l’acoustique, de la hauteur sous plafond."},{"titre":"La lumière","texte":"Le 12 août, le soleil se lève à 06 h 31 et se couche à 21 h 14 : 14 h 43 de jour, golden hour à partir de 20 h 14. Journée longue : le cocktail peut commencer avant le coucher du soleil et il restera de la lumière pour la séance photo."}],"statut":"PROPOSÉ"},"lumiere":{"date":"2026-08-12","lever":"06:31","coucher":"21:14","dureeJour":"14 h 43","goldenHourDebut":"20:14","heureBleueDebut":"21:51","heureBleueFin":"05:54","midiSolaire":"13:53","declinaison":14.9,"courbe":[0,0,0,0,0,0,0,5,20,36,51,65,77,85,87,83,74,62,47,32,17,2,0,0],"phrase":"Le 12 août, le soleil se lève à 06 h 31 et se couche à 21 h 14 : 14 h 43 de jour, golden hour à partir de 20 h 14.","methode":"calcul solaire NOAA simplifié","reference":"point de référence Lille 50.633 N / 3.067 E","precision":"± 1 à 3 minutes","status":"CALCULÉ"},"pratique":{"statut":"À VÉRIFIER","aVerifierRef":"typologie + standard du territoire"},"reperesDemo":{"budgetMontant":16000,"prestataires":21,"invites":40,"pages":25,"statut":"PROPOSÉ"},"lieuxAssocies":["L-010","L-001"],"coffretsLies":["C-156","C-175","C-006","C-207"],"art":{"hue":230,"sat":16,"light":13,"motif":"p2","methode":"génération déterministe (aucune image)","statut":"VÉRIFIÉ"},"mediaIds":["M-C-224-01"],"sources":[],"statut":"PROPOSÉ"}