{"id":"C-137","numero":137,"titre":"Béguinage & Papier","communeId":"CM-01","lieuId":"L-008","categorieId":"CAT-05","saisonId":"SA-02","moments":["MO-09","MO-10"],"calendrier":{"jour":137,"jourDuMois":17,"mois":4,"annee":2026,"statut":"VÉRIFIÉ"},"tags":["Lignes","Minimal","Architecture"],"accroche":"Ce que Jardin des Plantes permet d’imaginer, à Lille.","texte":"Jardin des Plantes — Lille. Lignes nettes, béton ciré, blanc absolu et ombres graphiques. Un objet éditorial pensé comme un plan-séquence : moodboard, repérages photo, timing de cérémonie et adresses 100 % métropole.","editorial":{"paragraphes":[{"titre":"Le lieu","texte":"Le végétal demande une chose : de la patience de repérage. Ce qui rend le décor intéressant, c’est la limite — l’allée, la lisière, le muret — pas le centre du parc."},{"titre":"Le moment","texte":"La séance photo est le seul moment qui se planifie à la minute : la fenêtre de lumière est courte et ne se rattrape pas. Ce qu’il faut prévoir : de l’heure dorée, des matières, de la profondeur. Le coffret retient aussi le repérage : du temps, un accès libre, une seconde visite à la bonne heure."},{"titre":"La lumière","texte":"Le 17 mai, le soleil se lève à 05 h 56 et se couche à 21 h 32 : 15 h 36 de jour, golden hour à partir de 20 h 32. Journée longue : le cocktail peut commencer avant le coucher du soleil et il restera de la lumière pour la séance photo."}],"statut":"PROPOSÉ"},"lumiere":{"date":"2026-05-17","lever":"05:56","coucher":"21:32","dureeJour":"15 h 36","goldenHourDebut":"20:32","heureBleueDebut":"22:13","heureBleueFin":"05:16","midiSolaire":"13:44","declinaison":19.4,"courbe":[0,0,0,0,0,0,0,13,28,43,58,73,85,93,95,89,79,65,50,35,20,6,0,0],"phrase":"Le 17 mai, le soleil se lève à 05 h 56 et se couche à 21 h 32 : 15 h 36 de jour, golden hour à partir de 20 h 32.","methode":"calcul solaire NOAA simplifié","reference":"point de référence Lille 50.633 N / 3.067 E","precision":"± 1 à 3 minutes","status":"CALCULÉ"},"pratique":{"statut":"À VÉRIFIER","aVerifierRef":"typologie + standard du territoire"},"reperesDemo":{"budgetMontant":27000,"prestataires":15,"invites":190,"pages":24,"statut":"PROPOSÉ"},"lieuxAssocies":["L-003","L-004"],"coffretsLies":["C-114","C-120","C-127","C-079"],"art":{"hue":233,"sat":13,"light":9,"motif":"p5","methode":"génération déterministe (aucune image)","statut":"VÉRIFIÉ"},"mediaIds":["M-C-137-01"],"sources":[],"statut":"PROPOSÉ"}