{"id":"C-167","numero":167,"titre":"Flandre & Blé","communeId":"CM-11","lieuId":"L-049","categorieId":"CAT-06","saisonId":"SA-03","moments":["MO-06","MO-08"],"calendrier":{"jour":167,"jourDuMois":16,"mois":5,"annee":2026,"statut":"VÉRIFIÉ"},"tags":["Baroque","Bougies","Laiton"],"accroche":"Ce que Parc de Loos permet d’imaginer, à Loos.","texte":"On entre par Parc de Loos, à Loos. Velours profond, laiton poli, bougies et or patiné. Le coffret déroule douze pages d’inspiration, la carte des lumières heure par heure et l’annuaire des artisans qui tiennent la journée debout.","editorial":{"paragraphes":[{"titre":"Le lieu","texte":"Le végétal demande une chose : de la patience de repérage. Ce qui rend le décor intéressant, c’est la limite — l’allée, la lisière, le muret — pas le centre du parc."},{"titre":"Le moment","texte":"Les discours tiennent à trois choses : un endroit où se mettre, une lumière qui isole et une acoustique qui pardonne. Ce qu’il faut prévoir : un point focal, un micro, une lumière qui isole. Le coffret retient aussi le brunch : un extérieur, une lumière douce, un service simple."},{"titre":"La lumière","texte":"Le 16 juin, le soleil se lève à 05 h 35 et se couche à 22 h 02 : 16 h 28 de jour, golden hour à partir de 21 h 02. Journée longue : le cocktail peut commencer avant le coucher du soleil et il restera de la lumière pour la séance photo."}],"statut":"PROPOSÉ"},"lumiere":{"date":"2026-06-16","lever":"05:35","coucher":"22:02","dureeJour":"16 h 28","goldenHourDebut":"21:02","heureBleueDebut":"22:48","heureBleueFin":"04:49","midiSolaire":"13:48","declinaison":23.4,"courbe":[0,0,0,0,0,0,4,17,32,47,62,77,90,99,101,96,85,71,56,41,26,12,0,0],"phrase":"Le 16 juin, le soleil se lève à 05 h 35 et se couche à 22 h 02 : 16 h 28 de jour, golden hour à partir de 21 h 02.","methode":"calcul solaire NOAA simplifié","reference":"point de référence Lille 50.633 N / 3.067 E","precision":"± 1 à 3 minutes","status":"CALCULÉ"},"pratique":{"statut":"À VÉRIFIER","aVerifierRef":"typologie + standard du territoire"},"reperesDemo":{"budgetMontant":19000,"prestataires":24,"invites":50,"pages":30,"statut":"PROPOSÉ"},"lieuxAssocies":["L-048","L-047"],"coffretsLies":["C-095","C-192","C-244","C-149"],"art":{"hue":39,"sat":64,"light":12,"motif":"p5","methode":"génération déterministe (aucune image)","statut":"VÉRIFIÉ"},"mediaIds":["M-C-167-01"],"sources":[],"statut":"PROPOSÉ"}