{"id":"C-169","numero":169,"titre":"Nord & Fumée","communeId":"CM-03","lieuId":"L-018","categorieId":"CAT-04","saisonId":"SA-03","moments":["MO-03","MO-01"],"calendrier":{"jour":169,"jourDuMois":18,"mois":5,"annee":2026,"statut":"VÉRIFIÉ"},"tags":["Lin","Serre","Houblon"],"accroche":"Ce que Hôtel de ville de Tourcoing permet d’imaginer, à Tourcoing.","texte":"Le décor : Hôtel de ville de Tourcoing, Tourcoing. Serres, houblon, fougères et lin brut froissé. Nous avons suivi les équipes du premier café au dernier verre, et tout consigné dans ce coffret numéroté.","editorial":{"paragraphes":[{"titre":"Le lieu","texte":"Ce genre d’architecture fixe déjà la palette (pierre, brique, boiseries, parquets). La piste éditoriale est inverse de l’habitude : retirer plutôt qu’ajouter, et laisser les volumes tenir la mise en scène."},{"titre":"Le moment","texte":"Une cérémonie se joue sur un axe et sur le silence. Plus le décor est fort (nef, verrière, mur plein), plus le reste doit être retiré. Ce qu’il faut prévoir : un axe, du silence, un fond qui ne concurrence pas. Le coffret retient aussi les préparatifs : de la place, de la lumière stable et personne dans le cadre."},{"titre":"La lumière","texte":"Le 18 juin, le soleil se lève à 05 h 35 et se couche à 22 h 03 : 16 h 28 de jour, golden hour à partir de 21 h 03. Journée longue : le cocktail peut commencer avant le coucher du soleil et il restera de la lumière pour la séance photo."}],"statut":"PROPOSÉ"},"lumiere":{"date":"2026-06-18","lever":"05:35","coucher":"22:03","dureeJour":"16 h 28","goldenHourDebut":"21:03","heureBleueDebut":"22:49","heureBleueFin":"04:49","midiSolaire":"13:49","declinaison":23.4,"courbe":[0,0,0,0,0,0,4,17,32,47,62,77,90,99,101,96,85,71,56,41,26,12,0,0],"phrase":"Le 18 juin, le soleil se lève à 05 h 35 et se couche à 22 h 03 : 16 h 28 de jour, golden hour à partir de 21 h 03.","methode":"calcul solaire NOAA simplifié","reference":"point de référence Lille 50.633 N / 3.067 E","precision":"± 1 à 3 minutes","status":"CALCULÉ"},"pratique":{"statut":"À VÉRIFIER","aVerifierRef":"typologie + standard du territoire"},"reperesDemo":{"budgetMontant":13000,"prestataires":9,"invites":150,"pages":26,"statut":"PROPOSÉ"},"lieuxAssocies":["L-022","L-017"],"coffretsLies":["C-162","C-239","C-143","C-155"],"art":{"hue":119,"sat":48,"light":11,"motif":"p1","methode":"génération déterministe (aucune image)","statut":"VÉRIFIÉ"},"mediaIds":["M-C-169-01"],"sources":[],"statut":"PROPOSÉ"}