{"id":"C-278","numero":278,"titre":"Grand-Place & Sel","communeId":"CM-02","lieuId":"L-011","categorieId":"CAT-04","saisonId":"SA-04","moments":["MO-08","MO-01"],"calendrier":{"jour":278,"jourDuMois":5,"mois":9,"annee":2026,"statut":"VÉRIFIÉ"},"tags":["Serre","Fougère","Houblon"],"accroche":"Un coffret ancré à La Condition Publique, Roubaix, dans l’univers « Végétal Brut ».","texte":"Dix heures de mariage en immersion à Roubaix, depuis La Condition Publique. Serres, houblon, fougères et lin brut froissé. À l’intérieur, les matières, les paliers de budget et les lieux alternatifs que personne ne vous montrera.","editorial":{"paragraphes":[{"titre":"Le lieu","texte":"La matière dominante ici, c’est le minéral chaud. Ce type de décor pardonne peu l’improvisation : il faut mesurer la lumière (brique, acier, verrières, béton brut) avant de choisir une heure de cérémonie."},{"titre":"Le moment","texte":"Le brunch profite de ce que personne ne remarque : la lumière de fin de matinée et un extérieur qui n’a pas été rangé pour la soirée. Ce qu’il faut prévoir : un extérieur, une lumière douce, un service simple. Le coffret retient aussi les préparatifs : de la place, de la lumière stable et personne dans le cadre."},{"titre":"La lumière","texte":"Le 5 octobre, le soleil se lève à 07 h 55 et se couche à 19 h 18 : 11 h 23 de jour, golden hour à partir de 18 h 18. Journée moyenne : la golden hour arrive tôt dans la soirée, c’est la fenêtre à réserver pour les photos."}],"statut":"PROPOSÉ"},"lumiere":{"date":"2026-10-05","lever":"07:55","coucher":"19:18","dureeJour":"11 h 23","goldenHourDebut":"18:18","heureBleueDebut":"19:50","heureBleueFin":"07:22","midiSolaire":"13:36","declinaison":-4.8,"courbe":[0,0,0,0,0,0,0,0,0,15,29,41,50,55,55,51,43,31,18,3,0,0,0,0],"phrase":"Le 5 octobre, le soleil se lève à 07 h 55 et se couche à 19 h 18 : 11 h 23 de jour, golden hour à partir de 18 h 18.","methode":"calcul solaire NOAA simplifié","reference":"point de référence Lille 50.633 N / 3.067 E","precision":"± 1 à 3 minutes","status":"CALCULÉ"},"pratique":{"statut":"À VÉRIFIER","aVerifierRef":"typologie + standard du territoire"},"reperesDemo":{"budgetMontant":23000,"prestataires":11,"invites":70,"pages":25,"statut":"PROPOSÉ"},"lieuxAssocies":["L-015","L-016"],"coffretsLies":["C-021","C-248","C-270","C-300"],"art":{"hue":127,"sat":45,"light":12,"motif":"p2","methode":"génération déterministe (aucune image)","statut":"VÉRIFIÉ"},"mediaIds":["M-C-278-01"],"sources":[],"statut":"PROPOSÉ"}