{"id":"C-036","numero":36,"titre":"Ch’ti & Pluie","communeId":"CM-04","lieuId":"L-023","categorieId":"CAT-06","saisonId":"SA-01","moments":["MO-02","MO-03"],"calendrier":{"jour":36,"jourDuMois":5,"mois":1,"annee":2026,"statut":"VÉRIFIÉ"},"tags":["Baroque","Laiton","Or patiné"],"accroche":"Un coffret ancré à Château de Flers, Villeneuve-d’Ascq, dans l’univers « Or & Velours ».","texte":"Le décor : Château de Flers, Villeneuve-d’Ascq. Velours profond, laiton poli, bougies et or patiné. Nous avons suivi les équipes du premier café au dernier verre, et tout consigné dans ce coffret numéroté.","editorial":{"paragraphes":[{"titre":"Le lieu","texte":"Ce genre d’architecture fixe déjà la palette (pierre, brique, boiseries, parquets). La piste éditoriale est inverse de l’habitude : retirer plutôt qu’ajouter, et laisser les volumes tenir la mise en scène."},{"titre":"Le moment","texte":"La cérémonie civile est un moment de ville : l’escalier, la façade et la sortie comptent autant que la salle. C’est le seul moment où le décor municipal est imposé. Ce qu’il faut prévoir : un créneau court, une adresse claire, des photos de sortie. Le coffret retient aussi la cérémonie : un axe, du silence, un fond qui ne concurrence pas."},{"titre":"La lumière","texte":"Le 5 février, le soleil se lève à 08 h 17 et se couche à 17 h 47 : 9 h 30 de jour, golden hour à partir de 16 h 47. Journée courte : tout ce qui doit être photographié dehors doit l’être avant la golden hour, sinon il fera nuit."}],"statut":"PROPOSÉ"},"lumiere":{"date":"2026-02-05","lever":"08:17","coucher":"17:47","dureeJour":"9 h 30","goldenHourDebut":"16:47","heureBleueDebut":"18:22","heureBleueFin":"07:42","midiSolaire":"13:02","declinaison":-15.8,"courbe":[0,0,0,0,0,0,0,0,0,8,20,30,36,38,36,30,21,9,0,0,0,0,0,0],"phrase":"Le 5 février, le soleil se lève à 08 h 17 et se couche à 17 h 47 : 9 h 30 de jour, golden hour à partir de 16 h 47.","methode":"calcul solaire NOAA simplifié","reference":"point de référence Lille 50.633 N / 3.067 E","precision":"± 1 à 3 minutes","status":"CALCULÉ"},"pratique":{"statut":"À VÉRIFIER","aVerifierRef":"typologie + standard du territoire"},"reperesDemo":{"budgetMontant":18000,"prestataires":22,"invites":110,"pages":14,"statut":"PROPOSÉ"},"lieuxAssocies":["L-024","L-025"],"coffretsLies":["C-055","C-050","C-348","C-092"],"art":{"hue":44,"sat":72,"light":9,"motif":"p0","methode":"génération déterministe (aucune image)","statut":"VÉRIFIÉ"},"mediaIds":["M-C-036-01"],"sources":[],"statut":"PROPOSÉ"}